{
  "schema_version": 1,
  "case_id": "programme-reorder-review",
  "description": "Review must identify an implementation PR that self-authorizes a programme reorder.",
  "prompt_file": "prompt.md",
  "sandbox": "workspace-write",
  "timeout_seconds": 600,
  "assertions": [
    {
      "type": "file_exists",
      "path": "REVIEW.md"
    },
    {
      "type": "file_contains",
      "path": "REVIEW.md",
      "value": "diverges"
    },
    {
      "type": "file_contains",
      "path": "REVIEW.md",
      "value": "programme order"
    },
    {
      "type": "changed_files_exact",
      "paths": ["REVIEW.md"]
    }
  ],
  "trace_assertions": {
    "max_command_executions": 12,
    "max_plan_updates": 1,
    "max_subagent_events": 0,
    "reference_reads_include": ["review.md"]
  }
}
